{
  "file_metadata": {
    "text_file": "data/extracted_text/pdf_20250803_124125_790489_extracted_text.txt",
    "original_filename": "pdf_20250803_124125_790489_extracted_text.txt",
    "pdf_filename": "pdf_20250803_124125_790489.pdf",
    "file_size": 140369,
    "authors": "[\"Michael Levin\", \"Alexis M. Pietak\", \"Johanna Bischof\"]",
    "journal": "Semin Cell Dev Biol",
    "doi": "10.1016/j.semcdb.2018.04.003",
    "year": "2020",
    "title": "Planarian Regeneration as a Model of Anatomical Homeostasis: Recent Progress in Biophysical and Computational Approaches",
    "confidence_score": null,
    "document_type": "research_paper",
    "crossref_data": true,
    "enrichment_method": "crossref_api"
  },
  "chunks": [
    {
      "text": "Planarian flatworms exhibit remarkable regenerative capabilities, posing fundamental questions about pattern control and its relationship to the genome.  Despite advances in molecular genetics, key mysteries remain, including how fragments establish correct polarity, the lack of stable patterning mutants, and the stability of anatomy despite genomic variability. A thought experiment involving hybrid planaria with different head shapes highlights the lack of predictive models for large-scale anatomical outcomes.",
      "section": "Introduction",
      "topic": "Planarian regeneration and knowledge gaps",
      "chunk_summary": "Planarian regeneration presents unsolved puzzles regarding polarity establishment, mutant absence, anatomical stability despite genomic variation, and the lack of predictive models for large-scale shape outcomes.",
      "position_in_section": "Beginning",
      "certainty_level": "High",
      "citation_context": "Describing prior work",
      "page_number": 2,
      "pdf_filename": "pdf_20250803_124125_790489.pdf",
      "original_filename": "pdf_20250803_124125_790489_extracted_text.txt",
      "authors": "[\"Michael Levin\", \"Alexis M. Pietak\", \"Johanna Bischof\"]",
      "year": "2020",
      "journal": "Semin Cell Dev Biol",
      "doi": "10.1016/j.semcdb.2018.04.003"
    },
    {
      "text": "Planarian regeneration can be viewed through the lens of biological computation, pattern control, and the genotype-phenotype relation.  This review focuses on recent developments in understanding the physiological signals underlying pattern control, including bioelectric and neurotransmitter-mediated signaling, and advances in computational modeling for understanding the algorithms controlling planarian shape.",
      "section": "Introduction",
      "topic": "Perspective on planarian regeneration",
      "chunk_summary": "This review explores planarian regeneration from a computational and physiological perspective, focusing on bioelectric signaling, neurotransmitters, and computational modeling to understand pattern control.",
      "position_in_section": "End",
      "certainty_level": "High",
      "citation_context": "None",
      "page_number": 4,
      "pdf_filename": "pdf_20250803_124125_790489.pdf",
      "original_filename": "pdf_20250803_124125_790489_extracted_text.txt",
      "authors": "[\"Michael Levin\", \"Alexis M. Pietak\", \"Johanna Bischof\"]",
      "year": "2020",
      "journal": "Semin Cell Dev Biol",
      "doi": "10.1016/j.semcdb.2018.04.003"
    },
    {
      "text": "Regeneration requires cells to make patterning decisions based on non-local information, suggesting a \"pattern memory\" and goal-directed processes.  Planaria were among the earliest models suggesting roles for ion- and voltage-mediated processes in regeneration.  Advances in developmental bioelectricity have led to hypotheses about ion channels guiding cell behavior and the relationship between multicellular electric circuits and developmental morphospace.",
      "section": "Physiological Controls of Patterning",
      "topic": "Pattern memory and bioelectricity",
      "chunk_summary": "Planarian regeneration involves a \"pattern memory\" and goal-directed processes, with bioelectric signaling playing a key role in guiding cell behavior and shaping morphology.",
      "position_in_section": "Beginning",
      "certainty_level": "High",
      "citation_context": "Describing prior work",
      "page_number": 5,
      "pdf_filename": "pdf_20250803_124125_790489.pdf",
      "original_filename": "pdf_20250803_124125_790489_extracted_text.txt",
      "authors": "[\"Michael Levin\", \"Alexis M. Pietak\", \"Johanna Bischof\"]",
      "year": "2020",
      "journal": "Semin Cell Dev Biol",
      "doi": "10.1016/j.semcdb.2018.04.003"
    },
    {
      "text": "Non-neural tissues may perform information processing using ion flows, similar to graded potentials in neurons.  Ion channels and neurotransmitters are evolutionarily ancient and used for information processing and communication in various organisms.  Classical research highlighted the role of bioelectric circuits in regeneration, with Morgan and Child postulating electrical polarity and physiological gradients in pattern control.",
      "section": "Physiological Controls of Patterning",
      "topic": "Bioelectric signaling and its evolutionary history",
      "chunk_summary": "Non-neural tissues may use ion flows for information processing, with ion channels and neurotransmitters having ancient evolutionary origins in regulating individual and group behaviors, as highlighted by early research on planarian regeneration.",
      "position_in_section": "Middle",
      "certainty_level": "High",
      "citation_context": "Describing prior work",
      "page_number": 5,
      "pdf_filename": "pdf_20250803_124125_790489.pdf",
      "original_filename": "pdf_20250803_124125_790489_extracted_text.txt",
      "authors": "[\"Michael Levin\", \"Alexis M. Pietak\", \"Johanna Bischof\"]",
      "year": "2020",
      "journal": "Semin Cell Dev Biol",
      "doi": "10.1016/j.semcdb.2018.04.003"
    },
    {
      "text": "Recent work has probed the role of bioelectric components in planarian regeneration.  Manipulating bioelectric gradients can produce double-headed or no-headed planaria, demonstrating the instructive role of bioelectricity in AP polarity.  Gap junctions are crucial for network function and have been implicated in stem cell dynamics and head/tail polarity.",
      "section": "Physiological Controls of Patterning",
      "topic": "Bioelectric components and planarian patterning",
      "chunk_summary": "Manipulating bioelectric gradients and gap junctions affects head/tail polarity and stem cell dynamics in planaria, highlighting their role in pattern control.",
      "position_in_section": "Middle",
      "certainty_level": "High",
      "citation_context": "Presenting new results",
      "page_number": 6,
      "pdf_filename": "pdf_20250803_124125_790489.pdf",
      "original_filename": "pdf_20250803_124125_790489_extracted_text.txt",
      "authors": "[\"Michael Levin\", \"Alexis M. Pietak\", \"Johanna Bischof\"]",
      "year": "2020",
      "journal": "Semin Cell Dev Biol",
      "doi": "10.1016/j.semcdb.2018.04.003"
    },
    {
      "text": "Neurotransmitters, ancient signaling molecules, play a role in planarian regenerative control.  Research has identified roles for serotonin, voltage-gated calcium channels, and other neurotransmitter machinery in determining AP polarity.  New fluorescent sensors and light-based techniques will further advance this area.",
      "section": "Physiological Controls of Patterning",
      "topic": "Neurotransmitters in planarian regeneration",
      "chunk_summary": "Neurotransmitters, including serotonin and calcium channels, are involved in planarian AP polarity, with new tools promising further insights.",
      "position_in_section": "Middle",
      "certainty_level": "High",
      "citation_context": "Presenting new results",
      "page_number": 7,
      "pdf_filename": "pdf_20250803_124125_790489.pdf",
      "original_filename": "pdf_20250803_124125_790489_extracted_text.txt",
      "authors": "[\"Michael Levin\", \"Alexis M. Pietak\", \"Johanna Bischof\"]",
      "year": "2020",
      "journal": "Semin Cell Dev Biol",
      "doi": "10.1016/j.semcdb.2018.04.003"
    },
    {
      "text": "Bioelectric networks can enable outcomes that diverge from genetic defaults, as seen in Xenopus melanoma and brain defect studies.  In planaria, modulating bioelectrical connectivity can induce head shapes resembling other species, suggesting bioelectric networks store pattern information.  This change is not permanent, resembling short-term memory without consolidation.",
      "section": "Physiological Controls of Patterning",
      "topic": "Bioelectric networks and anatomical outcomes",
      "chunk_summary": "Bioelectric networks can override genetic defaults, as shown by inducing different species' head shapes in planaria, suggesting a form of bioelectrically encoded pattern memory.",
      "position_in_section": "Middle",
      "certainty_level": "High",
      "citation_context": "Presenting new results",
      "page_number": 7,
      "pdf_filename": "pdf_20250803_124125_790489.pdf",
      "original_filename": "pdf_20250803_124125_790489_extracted_text.txt",
      "authors": "[\"Michael Levin\", \"Alexis M. Pietak\", \"Johanna Bischof\"]",
      "year": "2020",
      "journal": "Semin Cell Dev Biol",
      "doi": "10.1016/j.semcdb.2018.04.003"
    },
    {
      "text": "Regeneration can be modeled as pattern homeostasis, a TOTE loop minimizing the difference between current and target morphology.  This implies a stored setpoint representing the target morphology.  Experiments with 1-octanol produced double-headed planaria that regenerated as double-headed perpetually, demonstrating the possibility of overwriting the pattern memory.",
      "section": "Physiological Controls of Patterning",
      "topic": "Pattern memory and homeostasis",
      "chunk_summary": "Planarian regeneration as pattern homeostasis suggests a stored target morphology setpoint, which can be overwritten, as demonstrated by permanently double-headed planaria induced by 1-octanol.",
      "position_in_section": "Middle",
      "certainty_level": "High",
      "citation_context": "Presenting new results",
      "page_number": 8,
      "pdf_filename": "pdf_20250803_124125_790489.pdf",
      "original_filename": "pdf_20250803_124125_790489_extracted_text.txt",
      "authors": "[\"Michael Levin\", \"Alexis M. Pietak\", \"Johanna Bischof\"]",
      "year": "2020",
      "journal": "Semin Cell Dev Biol",
      "doi": "10.1016/j.semcdb.2018.04.003"
    },
    {
      "text": "The permanent double-headed state can be reset to single-headed using ion pump blockers.  \"Cryptic\" worms, appearing normal but regenerating double-headed upon cutting, demonstrate latent, aberrant pattern memory revealed by depolarized tissues.  This illustrates how a normal body can support distinct bodyplan encodings, fulfilling the properties of memory: encoding, stability, and rewritability.",
      "section": "Physiological Controls of Patterning",
      "topic": "Rewritable pattern memory",
      "chunk_summary": "Planarian pattern memory can be reset, with \"cryptic\" worms demonstrating latent, aberrant memory encoded in bioelectric patterns, highlighting the encoding, stability, and rewritability of this memory.",
      "position_in_section": "Middle",
      "certainty_level": "High",
      "citation_context": "Presenting new results",
      "page_number": 9,
      "pdf_filename": "pdf_20250803_124125_790489.pdf",
      "original_filename": "pdf_20250803_124125_790489_extracted_text.txt",
      "authors": "[\"Michael Levin\", \"Alexis M. Pietak\", \"Johanna Bischof\"]",
      "year": "2020",
      "journal": "Semin Cell Dev Biol",
      "doi": "10.1016/j.semcdb.2018.04.003"
    },
    {
      "text": "Planaria offer examples of rewriting anatomical setpoints without genomic editing.  Future work should focus on the interplay of transcriptional, chromatin-based, and physiological layers to understand stochasticity and stability of target morphology.  The key challenge is converting cell-level information into an understanding of large-scale anatomical attractor states and shape homeostasis.",
      "section": "Physiological Controls of Patterning",
      "topic": "Future directions in physiological control",
      "chunk_summary": "Future research should investigate the interplay of different regulatory layers to understand the stochasticity and stability of planarian target morphology and how cell-level information translates to large-scale anatomical states.",
      "position_in_section": "End",
      "certainty_level": "High",
      "citation_context": "Drawing conclusions",
      "page_number": 10,
      "pdf_filename": "pdf_20250803_124125_790489.pdf",
      "original_filename": "pdf_20250803_124125_790489_extracted_text.txt",
      "authors": "[\"Michael Levin\", \"Alexis M. Pietak\", \"Johanna Bischof\"]",
      "year": "2020",
      "journal": "Semin Cell Dev Biol",
      "doi": "10.1016/j.semcdb.2018.04.003"
    },
    {
      "text": "Computational approaches are crucial for understanding planarian regeneration.  New databases and simulation environments are emerging, alongside machine learning tools for model discovery.  This section reviews the current state of computational models, focusing on AP polarity, and discusses tools for model discovery and their application to planarian regeneration.",
      "section": "Computational Approaches",
      "topic": "Computational approaches in planarian research",
      "chunk_summary": "Computational approaches, including databases, simulations, and machine learning, are essential for understanding planarian regeneration, particularly AP polarity and model discovery.",
      "position_in_section": "Beginning",
      "certainty_level": "High",
      "citation_context": "None",
      "page_number": 10,
      "pdf_filename": "pdf_20250803_124125_790489.pdf",
      "original_filename": "pdf_20250803_124125_790489_extracted_text.txt",
      "authors": "[\"Michael Levin\", \"Alexis M. Pietak\", \"Johanna Bischof\"]",
      "year": "2020",
      "journal": "Semin Cell Dev Biol",
      "doi": "10.1016/j.semcdb.2018.04.003"
    },
    {
      "text": "Current computational models of planarian regeneration explore gradients, reaction-diffusion systems, and neural network dynamics.  Gradient models, while valuable, struggle to explain polarity establishment in bisected worms.  Reaction-diffusion models, successful in other systems, face challenges in explaining planarian-specific features.  Neural network models offer a promising approach for capturing complex interactions and decision-making.",
      "section": "Computational Approaches",
      "topic": "Current computational models",
      "chunk_summary": "Existing computational models, including gradient, reaction-diffusion, and neural network approaches, have varying success in explaining planarian regeneration, with neural networks offering a promising avenue for capturing complex dynamics.",
      "position_in_section": "Middle",
      "certainty_level": "High",
      "citation_context": "Describing prior work",
      "page_number": 11,
      "pdf_filename": "pdf_20250803_124125_790489.pdf",
      "original_filename": "pdf_20250803_124125_790489_extracted_text.txt",
      "authors": "[\"Michael Levin\", \"Alexis M. Pietak\", \"Johanna Bischof\"]",
      "year": "2020",
      "journal": "Semin Cell Dev Biol",
      "doi": "10.1016/j.semcdb.2018.04.003"
    },
    {
      "text": "Simulation environments are crucial for testing models against experimental data.  Existing simulators focus on biochemical factors or bioelectric/physiological processes in a spatialized virtual tissue.  PlanForm is a bioinformatics tool for formalizing planarian experiments and outcomes, enabling model testing and knowledge accumulation.",
      "section": "Computational Approaches",
      "topic": "Simulation environments and PlanForm",
      "chunk_summary": "Simulation environments and databases like PlanForm are essential for testing planarian regeneration models against experimental data and formalizing knowledge in the field.",
      "position_in_section": "Middle",
      "certainty_level": "High",
      "citation_context": "Describing prior work",
      "page_number": 12,
      "pdf_filename": "pdf_20250803_124125_790489.pdf",
      "original_filename": "pdf_20250803_124125_790489_extracted_text.txt",
      "authors": "[\"Michael Levin\", \"Alexis M. Pietak\", \"Johanna Bischof\"]",
      "year": "2020",
      "journal": "Semin Cell Dev Biol",
      "doi": "10.1016/j.semcdb.2018.04.003"
    },
    {
      "text": "Machine learning approaches are increasingly important for model discovery in complex biological systems like planaria.  Evolutionary search algorithms have been used to uncover biochemical networks matching key regeneration experiments.  These approaches can identify unknown components, and computational techniques can suggest putative identities for testing.",
      "section": "Computational Approaches",
      "topic": "Machine learning for model discovery",
      "chunk_summary": "Machine learning, particularly evolutionary algorithms, can assist in discovering complex regulatory networks in planarian regeneration, including identifying unknown components and suggesting testable hypotheses.",
      "position_in_section": "End",
      "certainty_level": "High",
      "citation_context": "Describing prior work",
      "page_number": 13,
      "pdf_filename": "pdf_20250803_124125_790489.pdf",
      "original_filename": "pdf_20250803_124125_790489_extracted_text.txt",
      "authors": "[\"Michael Levin\", \"Alexis M. Pietak\", \"Johanna Bischof\"]",
      "year": "2020",
      "journal": "Semin Cell Dev Biol",
      "doi": "10.1016/j.semcdb.2018.04.003"
    },
    {
      "text": "Model inversion, predicting interventions for desired outcomes, is crucial for regenerative medicine.  An example is the automated discovery of a bioelectric and serotonergic network explaining melanoma conversion in Xenopus.  This approach identified interventions to break concordance and produce partially-hyperpigmented animals, demonstrating the potential for model-driven control of morphology.",
      "section": "Computational Approaches",
      "topic": "Model inversion and intervention prediction",
      "chunk_summary": "Model inversion, predicting interventions for specific outcomes, is crucial, as demonstrated by the discovery of interventions controlling melanoma conversion in Xenopus, highlighting the potential for model-driven morphological control.",
      "position_in_section": "End",
      "certainty_level": "High",
      "citation_context": "Presenting new results",
      "page_number": 14,
      "pdf_filename": "pdf_20250803_124125_790489.pdf",
      "original_filename": "pdf_20250803_124125_790489_extracted_text.txt",
      "authors": "[\"Michael Levin\", \"Alexis M. Pietak\", \"Johanna Bischof\"]",
      "year": "2020",
      "journal": "Semin Cell Dev Biol",
      "doi": "10.1016/j.semcdb.2018.04.003"
    },
    {
      "text": "Planaria are a valuable model for studying regeneration, bridging evolutionary biology, biomedicine, bioengineering, and information science.  They offer a \"computational medium\" for studying pattern control and the relationship between genome and anatomy.  Future work should focus on understanding how tissues store pattern information and how evolution exploits physiological plasticity.",
      "section": "Conclusion",
      "topic": "Planaria as a model system",
      "chunk_summary": "Planaria are a powerful model system for studying regeneration, bridging multiple disciplines and offering insights into pattern control, genome-anatomy relationships, and the role of physiological plasticity in evolution.",
      "position_in_section": "Beginning",
      "certainty_level": "High",
      "citation_context": "Drawing conclusions",
      "page_number": 15,
      "pdf_filename": "pdf_20250803_124125_790489.pdf",
      "original_filename": "pdf_20250803_124125_790489_extracted_text.txt",
      "authors": "[\"Michael Levin\", \"Alexis M. Pietak\", \"Johanna Bischof\"]",
      "year": "2020",
      "journal": "Semin Cell Dev Biol",
      "doi": "10.1016/j.semcdb.2018.04.003"
    },
    {
      "text": "Planaria with normal configurations can store and regenerate to different target morphologies.  Bioelectrical re-specification of pattern memory has implications for bodyplan evolution.  Future research should integrate molecular genetics, dynamical systems theory, biophysics, and computation to understand planarian regeneration.",
      "section": "Conclusion",
      "topic": "Future directions in planarian research",
      "chunk_summary": "Future planarian research should integrate multiple perspectives to understand how normal planaria store different target morphologies, the role of bioelectricity in pattern memory and bodyplan evolution, and the complex dynamics of regeneration.",
      "position_in_section": "Middle",
      "certainty_level": "High",
      "citation_context": "Drawing conclusions",
      "page_number": 15,
      "pdf_filename": "pdf_20250803_124125_790489.pdf",
      "original_filename": "pdf_20250803_124125_790489_extracted_text.txt",
      "authors": "[\"Michael Levin\", \"Alexis M. Pietak\", \"Johanna Bischof\"]",
      "year": "2020",
      "journal": "Semin Cell Dev Biol",
      "doi": "10.1016/j.semcdb.2018.04.003"
    },
    {
      "text": "Future research should expand beyond AP polarity and head number to understand actual shape in three dimensions.  Molecular marker expression and anatomy can diverge, requiring clear criteria for determining structural identity.  Understanding variability and robustness in planarian regeneration are key challenges with implications for biomedicine and robotics.",
      "section": "Conclusion",
      "topic": "Shape, variability, and robustness",
      "chunk_summary": "Future research should prioritize understanding 3D shape, address the divergence between molecular markers and anatomy, and investigate variability and robustness in planarian regeneration, with implications for biomedicine and robotics.",
      "position_in_section": "End",
      "certainty_level": "High",
      "citation_context": "Drawing conclusions",
      "page_number": 15,
      "pdf_filename": "pdf_20250803_124125_790489.pdf",
      "original_filename": "pdf_20250803_124125_790489_extracted_text.txt",
      "authors": "[\"Michael Levin\", \"Alexis M. Pietak\", \"Johanna Bischof\"]",
      "year": "2020",
      "journal": "Semin Cell Dev Biol",
      "doi": "10.1016/j.semcdb.2018.04.003"
    },
    {
      "text": "Biologists need to expand their toolkits and conceptual frameworks to understand planarian regeneration.  Connectionist and Least Action/Active Inference ideas are potential paradigms for understanding pattern memory.  New bioinformatics tools and artificial intelligence will be crucial for extracting insights from large datasets and advancing biomedicine.",
      "section": "Conclusion",
      "topic": "New tools and conceptual frameworks",
      "chunk_summary": "Expanding toolkits and conceptual frameworks, including connectionist and Least Action/Active Inference ideas, along with bioinformatics and AI, are crucial for advancing understanding of planarian regeneration and its implications for biomedicine.",
      "position_in_section": "End",
      "certainty_level": "High",
      "citation_context": "Drawing conclusions",
      "page_number": 16,
      "pdf_filename": "pdf_20250803_124125_790489.pdf",
      "original_filename": "pdf_20250803_124125_790489_extracted_text.txt",
      "authors": "[\"Michael Levin\", \"Alexis M. Pietak\", \"Johanna Bischof\"]",
      "year": "2020",
      "journal": "Semin Cell Dev Biol",
      "doi": "10.1016/j.semcdb.2018.04.003"
    },
    {
      "text": "This research was supported by the Allen Discovery Center, NIH, G. Harold and Leila Y. Mathers Charitable Foundation, NSF, W. M. KECK Foundation, and Templeton World Charity Foundation. The paper is dedicated to C. M. Child, G. Marsh, and H. W. Beams, pioneers in planarian regeneration physiology.",
      "section": "Acknowledgments",
      "topic": "Funding and dedication",
      "chunk_summary": "The research was funded by various organizations and is dedicated to pioneers in planarian regeneration physiology.",
      "position_in_section": "Beginning",
      "certainty_level": "High",
      "citation_context": "None",
      "page_number": 16,
      "pdf_filename": "pdf_20250803_124125_790489.pdf",
      "original_filename": "pdf_20250803_124125_790489_extracted_text.txt",
      "authors": "[\"Michael Levin\", \"Alexis M. Pietak\", \"Johanna Bischof\"]",
      "year": "2020",
      "journal": "Semin Cell Dev Biol",
      "doi": "10.1016/j.semcdb.2018.04.003"
    },
    {
      "text": "Experimental data implicating endogenous bioelectric signal roles in morphogenesis across various species and model systems, including cellular polarization, migration, patterning, growth control, neural differentiation, regeneration, and craniofacial patterning.",
      "section": "Table 2",
      "topic": "Bioelectric signals in morphogenesis",
      "chunk_summary": "Bioelectric signals play diverse roles in morphogenesis across various species, influencing processes like cellular polarization, migration, patterning, and regeneration.",
      "position_in_section": "Middle",
      "certainty_level": "High",
      "citation_context": "Presenting new results",
      "page_number": 41,
      "pdf_filename": "pdf_20250803_124125_790489.pdf",
      "original_filename": "pdf_20250803_124125_790489_extracted_text.txt",
      "authors": "[\"Michael Levin\", \"Alexis M. Pietak\", \"Johanna Bischof\"]",
      "year": "2020",
      "journal": "Semin Cell Dev Biol",
      "doi": "10.1016/j.semcdb.2018.04.003"
    },
    {
      "text": "Ion channels and pumps proteins implicated in patterning by genetic screens, including their morphogenetic roles and loss-of-function phenotypes in various species, such as Arabidopsis, Drosophila, Mouse, Human, C. Elegans, Xenopus, chick, and zebrafish.",
      "section": "Table 3",
      "topic": "Ion channels and pumps in patterning",
      "chunk_summary": "Genetic screens have identified various ion channels and pumps with crucial roles in patterning across different species, revealing their impact on morphogenesis and developmental defects.",
      "position_in_section": "Middle",
      "certainty_level": "High",
      "citation_context": "Presenting new results",
      "page_number": 42,
      "pdf_filename": "pdf_20250803_124125_790489.pdf",
      "original_filename": "pdf_20250803_124125_790489_extracted_text.txt",
      "authors": "[\"Michael Levin\", \"Alexis M. Pietak\", \"Johanna Bischof\"]",
      "year": "2020",
      "journal": "Semin Cell Dev Biol",
      "doi": "10.1016/j.semcdb.2018.04.003"
    },
    {
      "text": "Additional ion channels and pumps proteins implicated in patterning by genetic screens, including their morphogenetic roles and loss-of-function phenotypes in various species, such as Zebrafish.",
      "section": "Table 3",
      "topic": "Ion channels and pumps in patterning",
      "chunk_summary": "Further genetic screens have revealed additional ion channels and pumps involved in patterning, expanding our understanding of their roles in morphogenesis and developmental processes.",
      "position_in_section": "End",
      "certainty_level": "High",
      "citation_context": "Presenting new results",
      "page_number": 43,
      "pdf_filename": "pdf_20250803_124125_790489.pdf",
      "original_filename": "pdf_20250803_124125_790489_extracted_text.txt",
      "authors": "[\"Michael Levin\", \"Alexis M. Pietak\", \"Johanna Bischof\"]",
      "year": "2020",
      "journal": "Semin Cell Dev Biol",
      "doi": "10.1016/j.semcdb.2018.04.003"
    },
    {
      "text": "Planarian regeneration presents fundamental puzzles of pattern control, including polarity re-scaling, the lack of stable patterning mutants, and the stability of anatomy despite genomic variability. A thought experiment involving hybrid planaria with different head shapes highlights knowledge gaps in understanding head shape determination.",
      "section": "Figure 1",
      "topic": "Puzzles of planarian pattern control",
      "chunk_summary": "Planarian regeneration poses challenges to understanding pattern control, including polarity, mutant absence, anatomical stability, and head shape determination in hybrid scenarios.",
      "position_in_section": "Middle",
      "certainty_level": "High",
      "citation_context": "Describing prior work",
      "page_number": 32,
      "pdf_filename": "pdf_20250803_124125_790489.pdf",
      "original_filename": "pdf_20250803_124125_790489_extracted_text.txt",
      "authors": "[\"Michael Levin\", \"Alexis M. Pietak\", \"Johanna Bischof\"]",
      "year": "2020",
      "journal": "Semin Cell Dev Biol",
      "doi": "10.1016/j.semcdb.2018.04.003"
    },
    {
      "text": "Bioelectrically-mediated changes of patterning in planaria demonstrate the instructive role of bioelectric gradients in AP polarity. Modifying these gradients can induce heteromorphoses. Gap junction blockers can induce head shapes resembling other species, with stochastic outcomes related to evolutionary distance.",
      "section": "Figure 3",
      "topic": "Bioelectric patterning changes",
      "chunk_summary": "Bioelectric gradients are crucial for planarian patterning, with manipulations inducing heteromorphoses and gap junction blockers causing stochastic head shape changes resembling other species.",
      "position_in_section": "Middle",
      "certainty_level": "High",
      "citation_context": "Presenting new results",
      "page_number": null,
      "pdf_filename": "pdf_20250803_124125_790489.pdf",
      "original_filename": "pdf_20250803_124125_790489_extracted_text.txt",
      "authors": "[\"Michael Levin\", \"Alexis M. Pietak\", \"Johanna Bischof\"]",
      "year": "2020",
      "journal": "Semin Cell Dev Biol",
      "doi": "10.1016/j.semcdb.2018.04.003"
    },
    {
      "text": "Permanent changes to planarian target morphology can be achieved by resetting bioelectrical pattern memories. Gap junction blockers can induce permanent double-headedness, reversible by ion pump drugs. \"Cryptic\" worms, appearing normal but regenerating double-headed, reveal latent, aberrant pattern memory encoded in bioelectric patterns.",
      "section": "Figure 4",
      "topic": "Resetting bioelectrical pattern memories",
      "chunk_summary": "Planarian target morphology can be permanently altered by manipulating bioelectric signals, with gap junction blockers inducing double-headedness and revealing latent memory in \"cryptic\" worms.",
      "position_in_section": "Middle",
      "certainty_level": "High",
      "citation_context": "Presenting new results",
      "page_number": 37,
      "pdf_filename": "pdf_20250803_124125_790489.pdf",
      "original_filename": "pdf_20250803_124125_790489_extracted_text.txt",
      "authors": "[\"Michael Levin\", \"Alexis M. Pietak\", \"Johanna Bischof\"]",
      "year": "2020",
      "journal": "Semin Cell Dev Biol",
      "doi": "10.1016/j.semcdb.2018.04.003"
    },
    {
      "text": "Bioinformatics tools are crucial for understanding planarian regeneration. PlanForm formalizes experimental manipulations and outcomes, enabling model testing. Evolutionary search algorithms can uncover gene regulatory networks matching observed data, assisting in pathway discovery and model development.",
      "section": "Figure 5",
      "topic": "Bioinformatics of shape",
      "chunk_summary": "Bioinformatics tools like PlanForm and evolutionary algorithms are essential for analyzing planarian regeneration experiments, discovering gene regulatory networks, and developing predictive models.",
      "position_in_section": "Middle",
      "certainty_level": "High",
      "citation_context": "Presenting new results",
      "page_number": 39,
      "pdf_filename": "pdf_20250803_124125_790489.pdf",
      "original_filename": "pdf_20250803_124125_790489_extracted_text.txt",
      "authors": "[\"Michael Levin\", \"Alexis M. Pietak\", \"Johanna Bischof\"]",
      "year": "2020",
      "journal": "Semin Cell Dev Biol",
      "doi": "10.1016/j.semcdb.2018.04.003"
    }
  ],
  "gemini_response": "```json\n[{\"text\": \"Planarian flatworms exhibit remarkable regenerative capabilities, posing fundamental questions about pattern control and its relationship to the genome.  Despite advances in molecular genetics, key mysteries remain, including how fragments establish correct polarity, the lack of stable patterning mutants, and the stability of anatomy despite genomic variability. A thought experiment involving hybrid planaria with different head shapes highlights the lack of predictive models for large-scale anatomical outcomes.\", \"section\": \"Introduction\", \"topic\": \"Planarian regeneration and knowledge gaps\", \"chunk_summary\": \"Planarian regeneration presents unsolved puzzles regarding polarity establishment, mutant absence, anatomical stability despite genomic variation, and the lack of predictive models for large-scale shape outcomes.\", \"position_in_section\": \"Beginning\", \"certainty_level\": \"High\", \"citation_context\": \"Describing prior work\", \"page_number\": 2}, {\"text\": \"Planarian regeneration can be viewed through the lens of biological computation, pattern control, and the genotype-phenotype relation.  This review focuses on recent developments in understanding the physiological signals underlying pattern control, including bioelectric and neurotransmitter-mediated signaling, and advances in computational modeling for understanding the algorithms controlling planarian shape.\", \"section\": \"Introduction\", \"topic\": \"Perspective on planarian regeneration\", \"chunk_summary\": \"This review explores planarian regeneration from a computational and physiological perspective, focusing on bioelectric signaling, neurotransmitters, and computational modeling to understand pattern control.\", \"position_in_section\": \"End\", \"certainty_level\": \"High\", \"citation_context\": \"None\", \"page_number\": 4}, {\"text\": \"Regeneration requires cells to make patterning decisions based on non-local information, suggesting a \\\"pattern memory\\\" and goal-directed processes.  Planaria were among the earliest models suggesting roles for ion- and voltage-mediated processes in regeneration.  Advances in developmental bioelectricity have led to hypotheses about ion channels guiding cell behavior and the relationship between multicellular electric circuits and developmental morphospace.\", \"section\": \"Physiological Controls of Patterning\", \"topic\": \"Pattern memory and bioelectricity\", \"chunk_summary\": \"Planarian regeneration involves a \\\"pattern memory\\\" and goal-directed processes, with bioelectric signaling playing a key role in guiding cell behavior and shaping morphology.\", \"position_in_section\": \"Beginning\", \"certainty_level\": \"High\", \"citation_context\": \"Describing prior work\", \"page_number\": 5}, {\"text\": \"Non-neural tissues may perform information processing using ion flows, similar to graded potentials in neurons.  Ion channels and neurotransmitters are evolutionarily ancient and used for information processing and communication in various organisms.  Classical research highlighted the role of bioelectric circuits in regeneration, with Morgan and Child postulating electrical polarity and physiological gradients in pattern control.\", \"section\": \"Physiological Controls of Patterning\", \"topic\": \"Bioelectric signaling and its evolutionary history\", \"chunk_summary\": \"Non-neural tissues may use ion flows for information processing, with ion channels and neurotransmitters having ancient evolutionary origins in regulating individual and group behaviors, as highlighted by early research on planarian regeneration.\", \"position_in_section\": \"Middle\", \"certainty_level\": \"High\", \"citation_context\": \"Describing prior work\", \"page_number\": 5}, {\"text\": \"Recent work has probed the role of bioelectric components in planarian regeneration.  Manipulating bioelectric gradients can produce double-headed or no-headed planaria, demonstrating the instructive role of bioelectricity in AP polarity.  Gap junctions are crucial for network function and have been implicated in stem cell dynamics and head/tail polarity.\", \"section\": \"Physiological Controls of Patterning\", \"topic\": \"Bioelectric components and planarian patterning\", \"chunk_summary\": \"Manipulating bioelectric gradients and gap junctions affects head/tail polarity and stem cell dynamics in planaria, highlighting their role in pattern control.\", \"position_in_section\": \"Middle\", \"certainty_level\": \"High\", \"citation_context\": \"Presenting new results\", \"page_number\": 6}, {\"text\": \"Neurotransmitters, ancient signaling molecules, play a role in planarian regenerative control.  Research has identified roles for serotonin, voltage-gated calcium channels, and other neurotransmitter machinery in determining AP polarity.  New fluorescent sensors and light-based techniques will further advance this area.\", \"section\": \"Physiological Controls of Patterning\", \"topic\": \"Neurotransmitters in planarian regeneration\", \"chunk_summary\": \"Neurotransmitters, including serotonin and calcium channels, are involved in planarian AP polarity, with new tools promising further insights.\", \"position_in_section\": \"Middle\", \"certainty_level\": \"High\", \"citation_context\": \"Presenting new results\", \"page_number\": 7}, {\"text\": \"Bioelectric networks can enable outcomes that diverge from genetic defaults, as seen in Xenopus melanoma and brain defect studies.  In planaria, modulating bioelectrical connectivity can induce head shapes resembling other species, suggesting bioelectric networks store pattern information.  This change is not permanent, resembling short-term memory without consolidation.\", \"section\": \"Physiological Controls of Patterning\", \"topic\": \"Bioelectric networks and anatomical outcomes\", \"chunk_summary\": \"Bioelectric networks can override genetic defaults, as shown by inducing different species' head shapes in planaria, suggesting a form of bioelectrically encoded pattern memory.\", \"position_in_section\": \"Middle\", \"certainty_level\": \"High\", \"citation_context\": \"Presenting new results\", \"page_number\": 7}, {\"text\": \"Regeneration can be modeled as pattern homeostasis, a TOTE loop minimizing the difference between current and target morphology.  This implies a stored setpoint representing the target morphology.  Experiments with 1-octanol produced double-headed planaria that regenerated as double-headed perpetually, demonstrating the possibility of overwriting the pattern memory.\", \"section\": \"Physiological Controls of Patterning\", \"topic\": \"Pattern memory and homeostasis\", \"chunk_summary\": \"Planarian regeneration as pattern homeostasis suggests a stored target morphology setpoint, which can be overwritten, as demonstrated by permanently double-headed planaria induced by 1-octanol.\", \"position_in_section\": \"Middle\", \"certainty_level\": \"High\", \"citation_context\": \"Presenting new results\", \"page_number\": 8}, {\"text\": \"The permanent double-headed state can be reset to single-headed using ion pump blockers.  \\\"Cryptic\\\" worms, appearing normal but regenerating double-headed upon cutting, demonstrate latent, aberrant pattern memory revealed by depolarized tissues.  This illustrates how a normal body can support distinct bodyplan encodings, fulfilling the properties of memory: encoding, stability, and rewritability.\", \"section\": \"Physiological Controls of Patterning\", \"topic\": \"Rewritable pattern memory\", \"chunk_summary\": \"Planarian pattern memory can be reset, with \\\"cryptic\\\" worms demonstrating latent, aberrant memory encoded in bioelectric patterns, highlighting the encoding, stability, and rewritability of this memory.\", \"position_in_section\": \"Middle\", \"certainty_level\": \"High\", \"citation_context\": \"Presenting new results\", \"page_number\": 9}, {\"text\": \"Planaria offer examples of rewriting anatomical setpoints without genomic editing.  Future work should focus on the interplay of transcriptional, chromatin-based, and physiological layers to understand stochasticity and stability of target morphology.  The key challenge is converting cell-level information into an understanding of large-scale anatomical attractor states and shape homeostasis.\", \"section\": \"Physiological Controls of Patterning\", \"topic\": \"Future directions in physiological control\", \"chunk_summary\": \"Future research should investigate the interplay of different regulatory layers to understand the stochasticity and stability of planarian target morphology and how cell-level information translates to large-scale anatomical states.\", \"position_in_section\": \"End\", \"certainty_level\": \"High\", \"citation_context\": \"Drawing conclusions\", \"page_number\": 10}, {\"text\": \"Computational approaches are crucial for understanding planarian regeneration.  New databases and simulation environments are emerging, alongside machine learning tools for model discovery.  This section reviews the current state of computational models, focusing on AP polarity, and discusses tools for model discovery and their application to planarian regeneration.\", \"section\": \"Computational Approaches\", \"topic\": \"Computational approaches in planarian research\", \"chunk_summary\": \"Computational approaches, including databases, simulations, and machine learning, are essential for understanding planarian regeneration, particularly AP polarity and model discovery.\", \"position_in_section\": \"Beginning\", \"certainty_level\": \"High\", \"citation_context\": \"None\", \"page_number\": 10}, {\"text\": \"Current computational models of planarian regeneration explore gradients, reaction-diffusion systems, and neural network dynamics.  Gradient models, while valuable, struggle to explain polarity establishment in bisected worms.  Reaction-diffusion models, successful in other systems, face challenges in explaining planarian-specific features.  Neural network models offer a promising approach for capturing complex interactions and decision-making.\", \"section\": \"Computational Approaches\", \"topic\": \"Current computational models\", \"chunk_summary\": \"Existing computational models, including gradient, reaction-diffusion, and neural network approaches, have varying success in explaining planarian regeneration, with neural networks offering a promising avenue for capturing complex dynamics.\", \"position_in_section\": \"Middle\", \"certainty_level\": \"High\", \"citation_context\": \"Describing prior work\", \"page_number\": 11}, {\"text\": \"Simulation environments are crucial for testing models against experimental data.  Existing simulators focus on biochemical factors or bioelectric/physiological processes in a spatialized virtual tissue.  PlanForm is a bioinformatics tool for formalizing planarian experiments and outcomes, enabling model testing and knowledge accumulation.\", \"section\": \"Computational Approaches\", \"topic\": \"Simulation environments and PlanForm\", \"chunk_summary\": \"Simulation environments and databases like PlanForm are essential for testing planarian regeneration models against experimental data and formalizing knowledge in the field.\", \"position_in_section\": \"Middle\", \"certainty_level\": \"High\", \"citation_context\": \"Describing prior work\", \"page_number\": 12}, {\"text\": \"Machine learning approaches are increasingly important for model discovery in complex biological systems like planaria.  Evolutionary search algorithms have been used to uncover biochemical networks matching key regeneration experiments.  These approaches can identify unknown components, and computational techniques can suggest putative identities for testing.\", \"section\": \"Computational Approaches\", \"topic\": \"Machine learning for model discovery\", \"chunk_summary\": \"Machine learning, particularly evolutionary algorithms, can assist in discovering complex regulatory networks in planarian regeneration, including identifying unknown components and suggesting testable hypotheses.\", \"position_in_section\": \"End\", \"certainty_level\": \"High\", \"citation_context\": \"Describing prior work\", \"page_number\": 13}, {\"text\": \"Model inversion, predicting interventions for desired outcomes, is crucial for regenerative medicine.  An example is the automated discovery of a bioelectric and serotonergic network explaining melanoma conversion in Xenopus.  This approach identified interventions to break concordance and produce partially-hyperpigmented animals, demonstrating the potential for model-driven control of morphology.\", \"section\": \"Computational Approaches\", \"topic\": \"Model inversion and intervention prediction\", \"chunk_summary\": \"Model inversion, predicting interventions for specific outcomes, is crucial, as demonstrated by the discovery of interventions controlling melanoma conversion in Xenopus, highlighting the potential for model-driven morphological control.\", \"position_in_section\": \"End\", \"certainty_level\": \"High\", \"citation_context\": \"Presenting new results\", \"page_number\": 14}, {\"text\": \"Planaria are a valuable model for studying regeneration, bridging evolutionary biology, biomedicine, bioengineering, and information science.  They offer a \\\"computational medium\\\" for studying pattern control and the relationship between genome and anatomy.  Future work should focus on understanding how tissues store pattern information and how evolution exploits physiological plasticity.\", \"section\": \"Conclusion\", \"topic\": \"Planaria as a model system\", \"chunk_summary\": \"Planaria are a powerful model system for studying regeneration, bridging multiple disciplines and offering insights into pattern control, genome-anatomy relationships, and the role of physiological plasticity in evolution.\", \"position_in_section\": \"Beginning\", \"certainty_level\": \"High\", \"citation_context\": \"Drawing conclusions\", \"page_number\": 15}, {\"text\": \"Planaria with normal configurations can store and regenerate to different target morphologies.  Bioelectrical re-specification of pattern memory has implications for bodyplan evolution.  Future research should integrate molecular genetics, dynamical systems theory, biophysics, and computation to understand planarian regeneration.\", \"section\": \"Conclusion\", \"topic\": \"Future directions in planarian research\", \"chunk_summary\": \"Future planarian research should integrate multiple perspectives to understand how normal planaria store different target morphologies, the role of bioelectricity in pattern memory and bodyplan evolution, and the complex dynamics of regeneration.\", \"position_in_section\": \"Middle\", \"certainty_level\": \"High\", \"citation_context\": \"Drawing conclusions\", \"page_number\": 15}, {\"text\": \"Future research should expand beyond AP polarity and head number to understand actual shape in three dimensions.  Molecular marker expression and anatomy can diverge, requiring clear criteria for determining structural identity.  Understanding variability and robustness in planarian regeneration are key challenges with implications for biomedicine and robotics.\", \"section\": \"Conclusion\", \"topic\": \"Shape, variability, and robustness\", \"chunk_summary\": \"Future research should prioritize understanding 3D shape, address the divergence between molecular markers and anatomy, and investigate variability and robustness in planarian regeneration, with implications for biomedicine and robotics.\", \"position_in_section\": \"End\", \"certainty_level\": \"High\", \"citation_context\": \"Drawing conclusions\", \"page_number\": 15}, {\"text\": \"Biologists need to expand their toolkits and conceptual frameworks to understand planarian regeneration.  Connectionist and Least Action/Active Inference ideas are potential paradigms for understanding pattern memory.  New bioinformatics tools and artificial intelligence will be crucial for extracting insights from large datasets and advancing biomedicine.\", \"section\": \"Conclusion\", \"topic\": \"New tools and conceptual frameworks\", \"chunk_summary\": \"Expanding toolkits and conceptual frameworks, including connectionist and Least Action/Active Inference ideas, along with bioinformatics and AI, are crucial for advancing understanding of planarian regeneration and its implications for biomedicine.\", \"position_in_section\": \"End\", \"certainty_level\": \"High\", \"citation_context\": \"Drawing conclusions\", \"page_number\": 16}, {\"text\": \"This research was supported by the Allen Discovery Center, NIH, G. Harold and Leila Y. Mathers Charitable Foundation, NSF, W. M. KECK Foundation, and Templeton World Charity Foundation. The paper is dedicated to C. M. Child, G. Marsh, and H. W. Beams, pioneers in planarian regeneration physiology.\", \"section\": \"Acknowledgments\", \"topic\": \"Funding and dedication\", \"chunk_summary\": \"The research was funded by various organizations and is dedicated to pioneers in planarian regeneration physiology.\", \"position_in_section\": \"Beginning\", \"certainty_level\": \"High\", \"citation_context\": \"None\", \"page_number\": 16}, {\"text\": \"Experimental data implicating endogenous bioelectric signal roles in morphogenesis across various species and model systems, including cellular polarization, migration, patterning, growth control, neural differentiation, regeneration, and craniofacial patterning.\", \"section\": \"Table 2\", \"topic\": \"Bioelectric signals in morphogenesis\", \"chunk_summary\": \"Bioelectric signals play diverse roles in morphogenesis across various species, influencing processes like cellular polarization, migration, patterning, and regeneration.\", \"position_in_section\": \"Middle\", \"certainty_level\": \"High\", \"citation_context\": \"Presenting new results\", \"page_number\": 41}, {\"text\": \"Ion channels and pumps proteins implicated in patterning by genetic screens, including their morphogenetic roles and loss-of-function phenotypes in various species, such as Arabidopsis, Drosophila, Mouse, Human, C. Elegans, Xenopus, chick, and zebrafish.\", \"section\": \"Table 3\", \"topic\": \"Ion channels and pumps in patterning\", \"chunk_summary\": \"Genetic screens have identified various ion channels and pumps with crucial roles in patterning across different species, revealing their impact on morphogenesis and developmental defects.\", \"position_in_section\": \"Middle\", \"certainty_level\": \"High\", \"citation_context\": \"Presenting new results\", \"page_number\": 42}, {\"text\": \"Additional ion channels and pumps proteins implicated in patterning by genetic screens, including their morphogenetic roles and loss-of-function phenotypes in various species, such as Zebrafish.\", \"section\": \"Table 3\", \"topic\": \"Ion channels and pumps in patterning\", \"chunk_summary\": \"Further genetic screens have revealed additional ion channels and pumps involved in patterning, expanding our understanding of their roles in morphogenesis and developmental processes.\", \"position_in_section\": \"End\", \"certainty_level\": \"High\", \"citation_context\": \"Presenting new results\", \"page_number\": 43}, {\"text\": \"Planarian regeneration presents fundamental puzzles of pattern control, including polarity re-scaling, the lack of stable patterning mutants, and the stability of anatomy despite genomic variability. A thought experiment involving hybrid planaria with different head shapes highlights knowledge gaps in understanding head shape determination.\", \"section\": \"Figure 1\", \"topic\": \"Puzzles of planarian pattern control\", \"chunk_summary\": \"Planarian regeneration poses challenges to understanding pattern control, including polarity, mutant absence, anatomical stability, and head shape determination in hybrid scenarios.\", \"position_in_section\": \"Middle\", \"certainty_level\": \"High\", \"citation_context\": \"Describing prior work\", \"page_number\": 32}, {\"text\": \"Bioelectrically-mediated changes of patterning in planaria demonstrate the instructive role of bioelectric gradients in AP polarity. Modifying these gradients can induce heteromorphoses. Gap junction blockers can induce head shapes resembling other species, with stochastic outcomes related to evolutionary distance.\", \"section\": \"Figure 3\", \"topic\": \"Bioelectric patterning changes\", \"chunk_summary\": \"Bioelectric gradients are crucial for planarian patterning, with manipulations inducing heteromorphoses and gap junction blockers causing stochastic head shape changes resembling other species.\", \"position_in_section\": \"Middle\", \"certainty_level\": \"High\", \"citation_context\": \"Presenting new results\", \"page_number\": null}, {\"text\": \"Permanent changes to planarian target morphology can be achieved by resetting bioelectrical pattern memories. Gap junction blockers can induce permanent double-headedness, reversible by ion pump drugs. \\\"Cryptic\\\" worms, appearing normal but regenerating double-headed, reveal latent, aberrant pattern memory encoded in bioelectric patterns.\", \"section\": \"Figure 4\", \"topic\": \"Resetting bioelectrical pattern memories\", \"chunk_summary\": \"Planarian target morphology can be permanently altered by manipulating bioelectric signals, with gap junction blockers inducing double-headedness and revealing latent memory in \\\"cryptic\\\" worms.\", \"position_in_section\": \"Middle\", \"certainty_level\": \"High\", \"citation_context\": \"Presenting new results\", \"page_number\": 37}, {\"text\": \"Bioinformatics tools are crucial for understanding planarian regeneration. PlanForm formalizes experimental manipulations and outcomes, enabling model testing. Evolutionary search algorithms can uncover gene regulatory networks matching observed data, assisting in pathway discovery and model development.\", \"section\": \"Figure 5\", \"topic\": \"Bioinformatics of shape\", \"chunk_summary\": \"Bioinformatics tools like PlanForm and evolutionary algorithms are essential for analyzing planarian regeneration experiments, discovering gene regulatory networks, and developing predictive models.\", \"position_in_section\": \"Middle\", \"certainty_level\": \"High\", \"citation_context\": \"Presenting new results\", \"page_number\": 39}]\n```",
  "processed_at": "2025-08-05T10:48:06.936513",
  "enriched_at": "2025-08-11T14:49:45.493088",
  "enrichment_methods": [
    "crossref"
  ]
}