{
  "file_metadata": {
    "text_file": "data/extracted_text/pdf_20250803_124126_863102_extracted_text.txt",
    "original_filename": "pdf_20250803_124126_863102_extracted_text.txt",
    "pdf_filename": "pdf_20250803_124126_863102.pdf",
    "file_size": 13642,
    "authors": "[\"Michael Levin\"]",
    "journal": "Animal Sentience",
    "doi": "10.51291/2377-7478.1733",
    "year": "2022",
    "title": "Generalizing frameworks for sentience beyond natural species",
    "confidence_score": null,
    "document_type": "research_paper",
    "crossref_data": true,
    "enrichment_method": "crossref_api"
  },
  "chunks": [
    {
      "text": "Crump et al. (2022) propose a framework for assessing sentience based on moral concern for an agent's welfare, which is a crucial development given advancements in bioengineering, AI, and exobiology.  Traditional criteria like verbal reports (Turing Test) and human brain homology are inadequate for evaluating novel, unconventional agents.  We need principled approaches to assess sentience and our responsibilities to beings with unfamiliar origins and compositions.",
      "section": "Abstract",
      "topic": "Sentience assessment framework",
      "chunk_summary": "A new framework for assessing sentience is needed due to advancements in creating novel agents, moving beyond traditional criteria like the Turing Test and brain homology.",
      "position_in_section": "Beginning",
      "certainty_level": "High",
      "citation_context": "Describing prior work",
      "page_number": 2,
      "pdf_filename": "pdf_20250803_124126_863102.pdf",
      "original_filename": "pdf_20250803_124126_863102_extracted_text.txt",
      "authors": "[\"Michael Levin\"]",
      "year": "2022",
      "journal": "Animal Sentience",
      "doi": "10.51291/2377-7478.1733"
    },
    {
      "text": "Crump et al.'s work addresses the practical and quantitative aspects of determining sentience and ethical concern, focusing on empirically grounded criteria rather than the Hard Problem of consciousness.  They emphasize avoiding false negatives in sentience criteria, which aligns with the field of \"minimal cognition\" exploring basic cognitive capacities in diverse organisms.",
      "section": "Introduction",
      "topic": "Practical approach to sentience",
      "chunk_summary": "The paper focuses on practical, quantitative criteria for sentience, avoiding the Hard Problem and prioritizing minimizing false negatives.",
      "position_in_section": "Beginning",
      "certainty_level": "High",
      "citation_context": "Describing prior work",
      "page_number": 2,
      "pdf_filename": "pdf_20250803_124126_863102.pdf",
      "original_filename": "pdf_20250803_124126_863102_extracted_text.txt",
      "authors": "[\"Michael Levin\"]",
      "year": "2022",
      "journal": "Animal Sentience",
      "doi": "10.51291/2377-7478.1733"
    },
    {
      "text": "Darwin's work highlighted the continuum between humans and other animals, and developmental biology shows a similar continuum from a single cell to a human mind.  However, these linear progressions are just a small part of the vast space of possible beings now emerging.",
      "section": "Introduction",
      "topic": "Expanding the concept of life",
      "chunk_summary": "The traditional view of life as a linear progression is being challenged by the emergence of diverse, novel agents.",
      "position_in_section": "Middle",
      "certainty_level": "High",
      "citation_context": "Describing prior work",
      "page_number": 3,
      "pdf_filename": "pdf_20250803_124126_863102.pdf",
      "original_filename": "pdf_20250803_124126_863102_extracted_text.txt",
      "authors": "[\"Michael Levin\"]",
      "year": "2022",
      "journal": "Animal Sentience",
      "doi": "10.51291/2377-7478.1733"
    },
    {
      "text": "Advancements in cyborgs, biorobotics, and synthetic morphology are blurring the lines between organisms and machines, creating novel agents with unique anatomies and control structures.  The plasticity of life allows for diverse combinations of evolved and designed materials, expanding the possibilities for sentience.",
      "section": "Introduction",
      "topic": "Novel agents and sentience",
      "chunk_summary": "Technological advancements are creating novel agents that blur the lines between organisms and machines, expanding the possibilities for sentience.",
      "position_in_section": "Middle",
      "certainty_level": "High",
      "citation_context": "Describing prior work",
      "page_number": 3,
      "pdf_filename": "pdf_20250803_124126_863102.pdf",
      "original_filename": "pdf_20250803_124126_863102_extracted_text.txt",
      "authors": "[\"Michael Levin\"]",
      "year": "2022",
      "journal": "Animal Sentience",
      "doi": "10.51291/2377-7478.1733"
    },
    {
      "text": "AI is producing agents with sophisticated linguistic abilities, while minimal cognition research reveals intelligence in other problem spaces.  Human ability to recognize agency is limited, and we need to adapt to evaluate intelligence in unfamiliar forms.",
      "section": "Introduction",
      "topic": "Recognizing diverse intelligence",
      "chunk_summary": "Human ability to recognize intelligence is limited, and we need to adapt to evaluate diverse forms of intelligence in unfamiliar problem spaces.",
      "position_in_section": "End",
      "certainty_level": "High",
      "citation_context": "Describing prior work",
      "page_number": 3,
      "pdf_filename": "pdf_20250803_124126_863102.pdf",
      "original_filename": "pdf_20250803_124126_863102_extracted_text.txt",
      "authors": "[\"Michael Levin\"]",
      "year": "2022",
      "journal": "Animal Sentience",
      "doi": "10.51291/2377-7478.1733"
    },
    {
      "text": "Traditional criteria for gauging moral responsibility, such as origin and appearance, are inadequate for the novel agents emerging.  We need frameworks that focus on fundamental aspects of sentience, not just superficial characteristics.",
      "section": "Introduction",
      "topic": "New frameworks for sentience",
      "chunk_summary": "Traditional criteria for assessing moral responsibility are inadequate for novel agents, and new frameworks focusing on fundamental aspects of sentience are needed.",
      "position_in_section": "End",
      "certainty_level": "High",
      "citation_context": "Describing prior work",
      "page_number": 4,
      "pdf_filename": "pdf_20250803_124126_863102.pdf",
      "original_filename": "pdf_20250803_124126_863102_extracted_text.txt",
      "authors": "[\"Michael Levin\"]",
      "year": "2022",
      "journal": "Animal Sentience",
      "doi": "10.51291/2377-7478.1733"
    },
    {
      "text": "Existing criteria for sentience are insufficient for the vast space of possible agents. Crump et al.'s criteria, while useful for natural species, need to be generalized for non-neural agents, as even gene regulatory networks can exhibit associative learning.  Their work provides a starting point for future research on non-neural sentience.",
      "section": "Discussion",
      "topic": "Generalizing sentience criteria",
      "chunk_summary": "Existing sentience criteria need to be generalized for non-neural agents, building on Crump et al.'s work as a starting point.",
      "position_in_section": "Beginning",
      "certainty_level": "High",
      "citation_context": "Describing prior work",
      "page_number": 4,
      "pdf_filename": "pdf_20250803_124126_863102.pdf",
      "original_filename": "pdf_20250803_124126_863102_extracted_text.txt",
      "authors": "[\"Michael Levin\"]",
      "year": "2022",
      "journal": "Animal Sentience",
      "doi": "10.51291/2377-7478.1733"
    },
    {
      "text": "The debate over the sentience of AI language models like LaMDA highlights the lack of clear criteria for assessing sentience.  Neither Turing-Test-like evidence nor brain homology are sufficient.  We need frameworks that can evaluate unconventional agents, including those with non-mammalian brains or even non-neural systems.",
      "section": "Discussion",
      "topic": "AI sentience and limitations of current criteria",
      "chunk_summary": "The LaMDA debate highlights the need for new sentience criteria that go beyond the Turing Test and brain homology to evaluate unconventional agents.",
      "position_in_section": "Middle",
      "certainty_level": "High",
      "citation_context": "Describing prior work",
      "page_number": 4,
      "pdf_filename": "pdf_20250803_124126_863102.pdf",
      "original_filename": "pdf_20250803_124126_863102_extracted_text.txt",
      "authors": "[\"Michael Levin\"]",
      "year": "2022",
      "journal": "Animal Sentience",
      "doi": "10.51291/2377-7478.1733"
    },
    {
      "text": "Traditional criteria like language, structure, and origin are insufficient for assessing sentience across diverse agents.  We need frameworks that identify deep invariants of sentience, moving beyond superficial characteristics.  Developing such frameworks is crucial for ethical decision-making regarding novel agents.",
      "section": "Discussion",
      "topic": "Deep invariants of sentience",
      "chunk_summary": "We need to identify deep invariants of sentience that go beyond superficial characteristics to assess sentience across diverse agents.",
      "position_in_section": "End",
      "certainty_level": "High",
      "citation_context": "Drawing conclusions",
      "page_number": 5,
      "pdf_filename": "pdf_20250803_124126_863102.pdf",
      "original_filename": "pdf_20250803_124126_863102_extracted_text.txt",
      "authors": "[\"Michael Levin\"]",
      "year": "2022",
      "journal": "Animal Sentience",
      "doi": "10.51291/2377-7478.1733"
    },
    {
      "text": "Developing a principled stance on sentience and agency is essential for humanity's future, both in our current and future embodiments.  Quantitative criteria like those proposed by Crump et al. are a step in the right direction, but further development is needed to address the full spectrum of possible agents.",
      "section": "Conclusion",
      "topic": "Future of sentience and agency",
      "chunk_summary": "A principled understanding of sentience and agency is crucial for humanity's future, and while current frameworks are a good start, further development is needed.",
      "position_in_section": "Beginning",
      "certainty_level": "High",
      "citation_context": "Drawing conclusions",
      "page_number": 5,
      "pdf_filename": "pdf_20250803_124126_863102.pdf",
      "original_filename": "pdf_20250803_124126_863102_extracted_text.txt",
      "authors": "[\"Michael Levin\"]",
      "year": "2022",
      "journal": "Animal Sentience",
      "doi": "10.51291/2377-7478.1733"
    },
    {
      "text": "Fields, C., Levin, M., 2022. Competency in Navigating Arbitrary Spaces as an Invariant for Analyzing Cognition in Diverse Embodiments. Entropy (Basel) 24. Friston, K., Levin, M., Sengupta, B., Pezzulo, G., 2015. Knowing one's place: a free-energy approach to pattern regulation. J R Soc Interface 12. Kagan, B.J., Kitchen, A.C., Tran, N.T., Parker, B.J., Bhat, A., Rollo, B., Razi, A., Friston, K.J., 2021. In vitro neurons learn and exhibit sentience when embodied in a simulated game-world. bioRxiv, 2021.2012.2002.471005. Kriegman, S., Blackiston, D., Levin, M., Bongard, J., 2020. A scalable pipeline for designing reconfigurable organisms. Proc Natl Acad Sci U S A 117, 1853-1859. Levin, M., 2019. The Computational Boundary of a “Self”: Developmental Bioelectricity Drives Multicellularity and Scale-Free Cognition. Front Psychol 10, 2688. Levin, M., 2020. Life, death, and self: Fundamental questions of primitive cognition viewed through the lens of body plasticity and synthetic organisms. Biochemical and Biophysical Research Communications 564, 114-133. Levin, M., Keijzer, F., Lyon, P., Arendt, D., 2021. Uncovering cognitive similarities and differences, conservation and innovation. Philos Trans R Soc Lond B Biol Sci 376, 20200458. Lyon, P., 2006. The biogenic approach to cognition. Cogn Process 7, 11-29. Lyon, P., 2020. Of what is \\\"minimal cognition\\\" the half-baked version? Adapt Behav 28, 407-424. Lyon, P., Keijzer, F., Arendt, D., Levin, M., 2021. Reframing cognition: getting down to biological basics. Philos Trans R Soc Lond B Biol Sci 376, 20190750. McGregor, S., Vasas, V., Husbands, P., Fernando, C., 2012. Evolution of associative learning in chemical networks. PLoS Computational Biology 8, e1002739. Nagel, T., 1986. The view from nowhere. Oxford University Press, New York. Orive, G., Taebnia, N., Dolatshahi-Pirouz, A., 2020. A New Era for Cyborg Science Is Emerging: The Promise of Cyborganic Beings. Adv Healthc Mater 9, e1901023. Pezzulo, G., Levin, M., 2015. Re-membering the body: applications of computational neuroscience to the top-down control of regeneration of limbs and other complex organs. Integr Biol (Camb) 7, 1487-1517. Pio-Lopez, L., 2021. The rise of the biocyborg: synthetic biology, artificial chimerism and human enhancement. New Genetics and Society 40, 599-619. Potter, S.M., Wagenaar, D.A., DeMarse, T.B., 2005. Closing the loop: stimulation feedback systems for embodied MEA cultures, in: Taketani, M., Baudry, M. (Eds.), Advances in Network Electrophysiology Using Multi-Electrode Arrays. Springer. Smith, J.A., Boyd, K.M., Institute of Medical Ethics (Great Britain), 1991. Lives in the balance : the ethics of using animals in biomedical research : the report of a Working Party of the Institute of Medical Ethics. Oxford University Press, Oxford; New York. Thopilan, R., De Freitas,, D., Hall, J,. et al. (2022) Lamda: Language models for dialog applications. arXiv preprint arXiv:2201.08239, 2022. Watson, R.A., Buckley, C.L., Mills, R., Davies, A., 2010. Associative memory in gene regulation networks, Artificial Life Conference XII, Odense, Denmark, pp. 194-201.",
      "section": "References",
      "topic": "Citations",
      "chunk_summary": "References cited throughout the paper.",
      "position_in_section": "Beginning",
      "certainty_level": "High",
      "citation_context": "None",
      "page_number": 5,
      "pdf_filename": "pdf_20250803_124126_863102.pdf",
      "original_filename": "pdf_20250803_124126_863102_extracted_text.txt",
      "authors": "[\"Michael Levin\"]",
      "year": "2022",
      "journal": "Animal Sentience",
      "doi": "10.51291/2377-7478.1733"
    }
  ],
  "gemini_response": "```json\n[\n{\"text\": \"Crump et al. (2022) propose a framework for assessing sentience based on moral concern for an agent's welfare, which is a crucial development given advancements in bioengineering, AI, and exobiology.  Traditional criteria like verbal reports (Turing Test) and human brain homology are inadequate for evaluating novel, unconventional agents.  We need principled approaches to assess sentience and our responsibilities to beings with unfamiliar origins and compositions.\", \"section\": \"Abstract\", \"topic\": \"Sentience assessment framework\", \"chunk_summary\": \"A new framework for assessing sentience is needed due to advancements in creating novel agents, moving beyond traditional criteria like the Turing Test and brain homology.\", \"position_in_section\": \"Beginning\", \"certainty_level\": \"High\", \"citation_context\": \"Describing prior work\", \"page_number\": 2},\n{\"text\": \"Crump et al.'s work addresses the practical and quantitative aspects of determining sentience and ethical concern, focusing on empirically grounded criteria rather than the Hard Problem of consciousness.  They emphasize avoiding false negatives in sentience criteria, which aligns with the field of \\\"minimal cognition\\\" exploring basic cognitive capacities in diverse organisms.\", \"section\": \"Introduction\", \"topic\": \"Practical approach to sentience\", \"chunk_summary\": \"The paper focuses on practical, quantitative criteria for sentience, avoiding the Hard Problem and prioritizing minimizing false negatives.\", \"position_in_section\": \"Beginning\", \"certainty_level\": \"High\", \"citation_context\": \"Describing prior work\", \"page_number\": 2},\n{\"text\": \"Darwin's work highlighted the continuum between humans and other animals, and developmental biology shows a similar continuum from a single cell to a human mind.  However, these linear progressions are just a small part of the vast space of possible beings now emerging.\", \"section\": \"Introduction\", \"topic\": \"Expanding the concept of life\", \"chunk_summary\": \"The traditional view of life as a linear progression is being challenged by the emergence of diverse, novel agents.\", \"position_in_section\": \"Middle\", \"certainty_level\": \"High\", \"citation_context\": \"Describing prior work\", \"page_number\": 3},\n{\"text\": \"Advancements in cyborgs, biorobotics, and synthetic morphology are blurring the lines between organisms and machines, creating novel agents with unique anatomies and control structures.  The plasticity of life allows for diverse combinations of evolved and designed materials, expanding the possibilities for sentience.\", \"section\": \"Introduction\", \"topic\": \"Novel agents and sentience\", \"chunk_summary\": \"Technological advancements are creating novel agents that blur the lines between organisms and machines, expanding the possibilities for sentience.\", \"position_in_section\": \"Middle\", \"certainty_level\": \"High\", \"citation_context\": \"Describing prior work\", \"page_number\": 3},\n{\"text\": \"AI is producing agents with sophisticated linguistic abilities, while minimal cognition research reveals intelligence in other problem spaces.  Human ability to recognize agency is limited, and we need to adapt to evaluate intelligence in unfamiliar forms.\", \"section\": \"Introduction\", \"topic\": \"Recognizing diverse intelligence\", \"chunk_summary\": \"Human ability to recognize intelligence is limited, and we need to adapt to evaluate diverse forms of intelligence in unfamiliar problem spaces.\", \"position_in_section\": \"End\", \"certainty_level\": \"High\", \"citation_context\": \"Describing prior work\", \"page_number\": 3},\n{\"text\": \"Traditional criteria for gauging moral responsibility, such as origin and appearance, are inadequate for the novel agents emerging.  We need frameworks that focus on fundamental aspects of sentience, not just superficial characteristics.\", \"section\": \"Introduction\", \"topic\": \"New frameworks for sentience\", \"chunk_summary\": \"Traditional criteria for assessing moral responsibility are inadequate for novel agents, and new frameworks focusing on fundamental aspects of sentience are needed.\", \"position_in_section\": \"End\", \"certainty_level\": \"High\", \"citation_context\": \"Describing prior work\", \"page_number\": 4},\n{\"text\": \"Existing criteria for sentience are insufficient for the vast space of possible agents. Crump et al.'s criteria, while useful for natural species, need to be generalized for non-neural agents, as even gene regulatory networks can exhibit associative learning.  Their work provides a starting point for future research on non-neural sentience.\", \"section\": \"Discussion\", \"topic\": \"Generalizing sentience criteria\", \"chunk_summary\": \"Existing sentience criteria need to be generalized for non-neural agents, building on Crump et al.'s work as a starting point.\", \"position_in_section\": \"Beginning\", \"certainty_level\": \"High\", \"citation_context\": \"Describing prior work\", \"page_number\": 4},\n{\"text\": \"The debate over the sentience of AI language models like LaMDA highlights the lack of clear criteria for assessing sentience.  Neither Turing-Test-like evidence nor brain homology are sufficient.  We need frameworks that can evaluate unconventional agents, including those with non-mammalian brains or even non-neural systems.\", \"section\": \"Discussion\", \"topic\": \"AI sentience and limitations of current criteria\", \"chunk_summary\": \"The LaMDA debate highlights the need for new sentience criteria that go beyond the Turing Test and brain homology to evaluate unconventional agents.\", \"position_in_section\": \"Middle\", \"certainty_level\": \"High\", \"citation_context\": \"Describing prior work\", \"page_number\": 4},\n{\"text\": \"Traditional criteria like language, structure, and origin are insufficient for assessing sentience across diverse agents.  We need frameworks that identify deep invariants of sentience, moving beyond superficial characteristics.  Developing such frameworks is crucial for ethical decision-making regarding novel agents.\", \"section\": \"Discussion\", \"topic\": \"Deep invariants of sentience\", \"chunk_summary\": \"We need to identify deep invariants of sentience that go beyond superficial characteristics to assess sentience across diverse agents.\", \"position_in_section\": \"End\", \"certainty_level\": \"High\", \"citation_context\": \"Drawing conclusions\", \"page_number\": 5},\n{\"text\": \"Developing a principled stance on sentience and agency is essential for humanity's future, both in our current and future embodiments.  Quantitative criteria like those proposed by Crump et al. are a step in the right direction, but further development is needed to address the full spectrum of possible agents.\", \"section\": \"Conclusion\", \"topic\": \"Future of sentience and agency\", \"chunk_summary\": \"A principled understanding of sentience and agency is crucial for humanity's future, and while current frameworks are a good start, further development is needed.\", \"position_in_section\": \"Beginning\", \"certainty_level\": \"High\", \"citation_context\": \"Drawing conclusions\", \"page_number\": 5},\n{\"text\": \"Fields, C., Levin, M., 2022. Competency in Navigating Arbitrary Spaces as an Invariant for Analyzing Cognition in Diverse Embodiments. Entropy (Basel) 24. Friston, K., Levin, M., Sengupta, B., Pezzulo, G., 2015. Knowing one's place: a free-energy approach to pattern regulation. J R Soc Interface 12. Kagan, B.J., Kitchen, A.C., Tran, N.T., Parker, B.J., Bhat, A., Rollo, B., Razi, A., Friston, K.J., 2021. In vitro neurons learn and exhibit sentience when embodied in a simulated game-world. bioRxiv, 2021.2012.2002.471005. Kriegman, S., Blackiston, D., Levin, M., Bongard, J., 2020. A scalable pipeline for designing reconfigurable organisms. Proc Natl Acad Sci U S A 117, 1853-1859. Levin, M., 2019. The Computational Boundary of a “Self”: Developmental Bioelectricity Drives Multicellularity and Scale-Free Cognition. Front Psychol 10, 2688. Levin, M., 2020. Life, death, and self: Fundamental questions of primitive cognition viewed through the lens of body plasticity and synthetic organisms. Biochemical and Biophysical Research Communications 564, 114-133. Levin, M., Keijzer, F., Lyon, P., Arendt, D., 2021. Uncovering cognitive similarities and differences, conservation and innovation. Philos Trans R Soc Lond B Biol Sci 376, 20200458. Lyon, P., 2006. The biogenic approach to cognition. Cogn Process 7, 11-29. Lyon, P., 2020. Of what is \\\\\\\"minimal cognition\\\\\\\" the half-baked version? Adapt Behav 28, 407-424. Lyon, P., Keijzer, F., Arendt, D., Levin, M., 2021. Reframing cognition: getting down to biological basics. Philos Trans R Soc Lond B Biol Sci 376, 20190750. McGregor, S., Vasas, V., Husbands, P., Fernando, C., 2012. Evolution of associative learning in chemical networks. PLoS Computational Biology 8, e1002739. Nagel, T., 1986. The view from nowhere. Oxford University Press, New York. Orive, G., Taebnia, N., Dolatshahi-Pirouz, A., 2020. A New Era for Cyborg Science Is Emerging: The Promise of Cyborganic Beings. Adv Healthc Mater 9, e1901023. Pezzulo, G., Levin, M., 2015. Re-membering the body: applications of computational neuroscience to the top-down control of regeneration of limbs and other complex organs. Integr Biol (Camb) 7, 1487-1517. Pio-Lopez, L., 2021. The rise of the biocyborg: synthetic biology, artificial chimerism and human enhancement. New Genetics and Society 40, 599-619. Potter, S.M., Wagenaar, D.A., DeMarse, T.B., 2005. Closing the loop: stimulation feedback systems for embodied MEA cultures, in: Taketani, M., Baudry, M. (Eds.), Advances in Network Electrophysiology Using Multi-Electrode Arrays. Springer. Smith, J.A., Boyd, K.M., Institute of Medical Ethics (Great Britain), 1991. Lives in the balance : the ethics of using animals in biomedical research : the report of a Working Party of the Institute of Medical Ethics. Oxford University Press, Oxford; New York. Thopilan, R., De Freitas,, D., Hall, J,. et al. (2022) Lamda: Language models for dialog applications. arXiv preprint arXiv:2201.08239, 2022. Watson, R.A., Buckley, C.L., Mills, R., Davies, A., 2010. Associative memory in gene regulation networks, Artificial Life Conference XII, Odense, Denmark, pp. 194-201.\", \"section\": \"References\", \"topic\": \"Citations\", \"chunk_summary\": \"References cited throughout the paper.\", \"position_in_section\": \"Beginning\", \"certainty_level\": \"High\", \"citation_context\": \"None\", \"page_number\": 5}\n]\n```",
  "processed_at": "2025-08-05T10:46:35.637529",
  "enriched_at": "2025-08-11T14:27:25.493449",
  "enrichment_methods": [
    "crossref"
  ]
}